{
  "manifestVersion": 1,
  "protocolVersion": 1,
  "pluginId": "aih.pricing.official.anthropic",
  "version": "0.1.0",
  "engines": {
    "aih": ">=1.0.0",
    "node": ">=22"
  },
  "runtime": "node",
  "entry": "index.mjs",
  "targets": [
    "any"
  ],
  "contributes": [
    {
      "id": "aih.pricing.official.anthropic.catalog",
      "capability": "pricing.catalog",
      "version": 1
    }
  ],
  "permissions": {
    "network": [
      "https://platform.claude.com"
    ],
    "filesystem": {
      "read": [],
      "write": []
    },
    "secrets": [],
    "environment": []
  }
}
